<?xml version="1.0"?>
<!DOCTYPE dialogue SYSTEM "./dmtl.dtd">
<dialogue>
    <macros>
	<!-- Technical Words: Talking Heads -->
        <macro name="THS">
            <stimulus type="text">
                th
            </stimulus>
            <stimulus type="text">
                ths
            </stimulus>
            <stimulus type="text">
                talking head
            </stimulus>
            <stimulus type="text">
                talking heads
            </stimulus>
        </macro>
        <macro name="NATURAL_LANGUAGE">
            <stimulus type="text">
                natural language
            </stimulus>
        </macro>
        <macro name="KEY_FRAME">
            <stimulus type="text">
                key-frame
            </stimulus>
            <stimulus type="text">
                key frame 
            </stimulus>
            <stimulus type="text">
                keyframe 
            </stimulus>
            <stimulus type="text">
                key-frame algorithm
            </stimulus>
            <stimulus type="text">
                key frame algorithm
            </stimulus>
            <stimulus type="text">
                keyframe algorithm
            </stimulus>
            <stimulus type="text">
		key-frame animation
            </stimulus>
            <stimulus type="text">
                key frame animation
            </stimulus>
            <stimulus type="text">
                keyframe animation
            </stimulus>
        </macro>
        <macro name="PARAMETER_BASED">
            <stimulus type="text">
                parameter-based
            </stimulus>
            <stimulus type="text">
                parameter based
            </stimulus>
            <stimulus type="text">
                parameterbased
            </stimulus>
            <stimulus type="text">
                parameter-based algorithm
            </stimulus>
            <stimulus type="text">
                parameter based algorithm
            </stimulus>
            <stimulus type="text">
                parameterbased algorithm
            </stimulus>
            <stimulus type="text">
                parameter-based animation
            </stimulus>
            <stimulus type="text">
                parameter based animation
            </stimulus>
            <stimulus type="text">
                parameterbased animation
            </stimulus>
        </macro>
        <macro name="DOWNLOAD_TO_CACHE">
            <stimulus type="text">
                download-to-cache
            </stimulus>
            <stimulus type="text">
                download to cache
            </stimulus>
            <stimulus type="text">
                download-to-cache transmission
            </stimulus>
            <stimulus type="text">
                download to cache transmission
            </stimulus>
            <stimulus type="text">
                download-to-cache data transmission
            </stimulus>
            <stimulus type="text">
                download to cache data transmission
            </stimulus>
        </macro>
        <macro name="PROGRESSIVE_DOWNLOAD">
            <stimulus type="text">
                progressive download
            </stimulus>
            <stimulus type="text">
                progressive download transmission
            </stimulus>
            <stimulus type="text">
                progressive download data transmission
            </stimulus>
            <stimulus type="text">
                progressive
            </stimulus>
            <stimulus type="text">
                progressive transmission
            </stimulus>
            <stimulus type="text">
                progressive data
            </stimulus>
        </macro>
        <macro name="REAL_TIME">
            <stimulus type="text">
                real-time
            </stimulus>
            <stimulus type="text">
                real time
            </stimulus>
            <stimulus type="text">
                realtime
            </stimulus>
            <stimulus type="text">
                real-time streaming
            </stimulus>
            <stimulus type="text">
                real time streaming
            </stimulus>
            <stimulus type="text">
                realtime streaming
            </stimulus>
            <stimulus type="text">
                real-time transmission
            </stimulus>
            <stimulus type="text">
                real time transmission
            </stimulus>
            <stimulus type="text">
                realtime transmission 
            </stimulus>
            <stimulus type="text">
                real-time data transmission
            </stimulus>
            <stimulus type="text">
                real time data transmission
            </stimulus>
            <stimulus type="text">
                realtime data transmission
            </stimulus>
        </macro>
        <macro name="3D">
            <stimulus type="text">
                3d
            </stimulus>
            <stimulus type="text">
                3-d
            </stimulus>
            <stimulus type="text">
                three-d
            </stimulus>
            <stimulus type="text">
                three d
            </stimulus>
            <stimulus type="text">
                3 dimensional
            </stimulus>
            <stimulus type="text">
                3-dimensional
            </stimulus>
            <stimulus type="text">
                three dimensional
            </stimulus>
            <stimulus type="text">
                three-dimensional
            </stimulus>
            <stimulus type="text">
                three dimensions
            </stimulus>
        </macro>
        <macro name="2D">
            <stimulus type="text">
                2d
            </stimulus>
            <stimulus type="text">
                2-d
            </stimulus>
            <stimulus type="text">
                two-d
            </stimulus>
            <stimulus type="text">
                two d
            </stimulus>
            <stimulus type="text">
                2 dimensional
            </stimulus>
            <stimulus type="text">
                2-dimensional
            </stimulus>
            <stimulus type="text">
                two dimensional
            </stimulus>
            <stimulus type="text">
                two-dimensional
            </stimulus>
            <stimulus type="text">
                two dimensions
            </stimulus>
        </macro>
	<macro name="IBR">
            <stimulus type="text">
                ibr
            </stimulus>
            <stimulus type="text">
                image-based rendering
            </stimulus>
            <stimulus type="text">
                image based rendering
            </stimulus>
            <stimulus type="text">
                imagebased rendering
            </stimulus>
        </macro>

	<!-- Technical Words: MPEG-4 -->
        <macro name="_MPEG">
            <stimulus type="text">
                moving picture experts group
            </stimulus>
            <stimulus type="text">
                moving pictures expert group
            </stimulus>
            <stimulus type="text">
                moving pictures experts group
            </stimulus>
            <stimulus type="text">
                moving picture expert group
            </stimulus>
        </macro>
        <macro name="MPEG4">
            <stimulus type="text">
                mpeg-4
            </stimulus>
            <stimulus type="text">
                mpeg4
            </stimulus>
            <stimulus type="text">
                mpeg 4
            </stimulus>
            <stimulus type="text">
                _MPEG 4
            </stimulus>
            <stimulus type="text">
                _MPEG
            </stimulus>
        </macro>
        <macro name="PHONEME">
            <stimulus type="text">
                phoneme
            </stimulus>
            <stimulus type="text">
                phonemes
            </stimulus>
        </macro>
        <macro name="VISEME">
            <stimulus type="text">
                viseme
            </stimulus>
            <stimulus type="text">
                visemes
            </stimulus>
        </macro>
        <macro name="PROSODY">
            <stimulus type="text">
                prosody
            </stimulus>
            <stimulus type="text">
                range
            </stimulus>
            <stimulus type="text">
                pitch
            </stimulus>
            <stimulus type="text">
                speed
            </stimulus>
            <stimulus type="text">
                rate
            </stimulus>
        </macro>	
        <macro name="VISUAL_STANDARD">
            <stimulus type="text">
                visual standard
            </stimulus>
            <stimulus type="text">
                visual-standard
            </stimulus>
            <stimulus type="text">
                visual std
            </stimulus>
        </macro>
        <macro name="_FACIAL">
            <stimulus type="text">
                facial
            </stimulus>
            <stimulus type="text">
                face
            </stimulus>
        </macro>
        <macro name="FACIAL_ANIMATION">
            <stimulus type="text">
                _FACIAL animation
            </stimulus>
        </macro>
        <macro name="NEUTRAL_FACE">
            <stimulus type="text">
                neutral face
            </stimulus>